Sekcja,Klucz,Treść
Wzorzec nastrojenia,Rysunek,"łuk otwarty na północ, trzy punkty na wschód-zachód, linia cienka"
Wzorzec nastrojenia,Głos,"półgłosem, nieśpiesznie, bez akcentów – płynny rytm oddechu"
Wzorzec nastrojenia,Formuła,"Lahif azif, la sawt wa la naam – tylko puls"
Obserwacje,Zjawiska,"zimniejszy przeciąg, ucichnięcie tykającego zegara, wrażenie „pustki” za plecami"
Praktyka,Notatki,"zaznaczaj czas pojawienia się objawów i ich kolejność – układają się w schematy"
Ostrzeżenia,Zakazy,"nie patrz w lustra, nie powtarzaj formuły więcej niż 5 cykli"